{
  "schema_version": "1.0.0",
  "manifest_id": "MF-UC-001-MANIFEST",
  "campaign_id": "UC-001",
  "title": "Union-Closed Sets provider coverage",
  "coverage_mode": "native",
  "provider_repository": "grandchallenge/MATHFORGE",
  "programme": {
    "repository": "grandchallenge/MATH-PROGRAMME",
    "commit": "54f233a2c3b0d91451f6900247e941d08eb0779f",
    "issue": 1,
    "paths": ["DOMAIN_01_UNION_CLOSED_MASTER_PLAN.md"]
  },
  "handoff_packet": {
    "problem_card": {"state": "present", "references": ["domains/union_closed/union_closed_small_audit.json"], "reason": "Native provider record exists."},
    "source_map": {"state": "present", "references": ["domains/union_closed/union_closed_small_audit.json"], "reason": "Native source or provenance record exists."},
    "status_triage": {"state": "present", "references": ["domains/union_closed/union_closed_small_audit.json"], "reason": "Native dated status boundary exists."},
    "reconnaissance_ledger": {"state": "present", "references": ["domains/union_closed/union_closed_small_audit.json"], "reason": "Native finite, fixture, or candidate ledger exists."},
    "failure_risks": {"state": "present", "references": ["domains/union_closed/union_closed_small_audit.json"], "reason": "Native false-proof or risk boundary exists."},
    "suggested_wp01": {"state": "present", "references": ["domains/union_closed/union_closed_small_audit.json"], "reason": "Provider record identifies the bounded next lane."},
    "certification_route_sketch": {"state": "present", "references": ["domains/union_closed/union_closed_small_audit.json"], "reason": "Provider record preserves the downstream proof boundary."}
  },
  "artifacts": [
    {
      "artifact_id": "UC-SMALL-AUDIT",
      "kind": "exact_finite_reconnaissance",
      "ownership": "MATHFORGE",
      "path": "domains/union_closed/union_closed_small_audit.json",
      "integrity": {"algorithm": "git_blob_sha1", "value": "c7915b572106a19dd01b40bbbd5c8c698a6414aa"},
      "claim_boundary": "Exact enumeration through n <= 4 validates definitions and tooling only; it is not asymptotic evidence for Frankl's conjecture."
    }
  ],
  "source_records": [{"record_id": "UC-001-SOURCE", "summary": "Native Forge source or discovery record is registered.", "references": ["domains/union_closed/union_closed_small_audit.json"]}],
  "status_records": [{"record_id": "UC-001-STATUS", "summary": "Status is bounded by the registered provider artifacts and Programme claim ledger.", "references": ["DOMAIN_01_UNION_CLOSED_MASTER_PLAN.md"]}],
  "fixtures": [{"record_id": "UC-001-FIXTURES", "summary": "Native finite or adversarial fixtures are registered where available.", "references": ["domains/union_closed/union_closed_small_audit.json"]}],
  "failed_routes": [{"record_id": "UC-001-FAILED", "summary": "Failure risks remain explicit and are not promoted into negative theorem claims.", "references": ["domains/union_closed/union_closed_small_audit.json"]}],
  "provenance": {"created_at": "2026-07-28", "created_by": "MF-GOV-WP00", "source_commits": ["f991762ad212984f972bfba7a5bc04fd0ed39ee9"]},
  "downstream_references": {"programme": ["DOMAIN_01_UNION_CLOSED_MASTER_PLAN.md"], "mathsolve": [], "mathcert": []},
  "provider_debt": [],
  "non_certification_statement": "This manifest records MATHFORGE provider evidence and provenance only. It does not certify, prove, or promote the campaign target."
}
